{
  "$schema": "https://json-schema.org/draft/2020-12/schema",
  "title": "Falsification Queue Item",
  "type": "object",
  "required": [
    "item_id",
    "pattern_id",
    "target_uncertainty",
    "pattern_claim_at_risk",
    "evidence_source",
    "collection_action",
    "supporting_result",
    "disconfirming_result",
    "priority_rationale",
    "revision",
    "impact_state"
  ],
  "properties": {
    "item_id": {
      "type": "string",
      "pattern": "^FQ-"
    },
    "pattern_id": {
      "type": "string"
    },
    "target_uncertainty": {
      "type": "string"
    },
    "pattern_claim_at_risk": {
      "type": "string"
    },
    "evidence_source": {
      "type": "string"
    },
    "collection_action": {
      "type": "string"
    },
    "supporting_result": {
      "type": "string"
    },
    "disconfirming_result": {
      "type": "string"
    },
    "sampling_instruction": {
      "type": "string"
    },
    "priority_rationale": {
      "type": "string"
    },
    "status": {
      "enum": [
        "queued",
        "collecting",
        "resolved",
        "blocked"
      ]
    },
    "resolution": {
      "type": [
        "string",
        "null"
      ]
    },
    "revision": {
      "type": "integer",
      "minimum": 1
    },
    "created_at": {
      "type": [
        "string",
        "null"
      ]
    },
    "updated_at": {
      "type": [
        "string",
        "null"
      ]
    },
    "updated_by": {
      "type": [
        "string",
        "null"
      ]
    },
    "supersedes": {
      "type": [
        "string",
        "null"
      ]
    },
    "impact_state": {
      "enum": [
        "current",
        "needs_review",
        "stale"
      ]
    },
    "relations": {
      "type": "array",
      "items": {
        "type": "object",
        "properties": {
          "type": {
            "enum": [
              "derived_from",
              "supports",
              "contradicts",
              "qualifies",
              "duplicates",
              "same_episode",
              "supersedes",
              "split_from",
              "tests"
            ]
          },
          "target_id": {
            "type": "string"
          },
          "note": {
            "type": [
              "string",
              "null"
            ]
          }
        },
        "required": [
          "type",
          "target_id"
        ]
      }
    }
  }
}