{
  "item_id": "FQ-20260926-a1b2c3",
  "pattern_id": "PP-20260926-a1b2c3",
  "target_uncertainty": "Uncertainty that could materially change the pattern.",
  "pattern_claim_at_risk": "Specific pattern claim being tested.",
  "evidence_source": "Who or what can discriminate between explanations.",
  "collection_action": "Specific question, observation, or case to collect.",
  "supporting_result": "Result that would strengthen the candidate pattern.",
  "disconfirming_result": "Result that would weaken, split, or reject the pattern.",
  "sampling_instruction": "Seek a case not selected for enthusiasm toward the proposed solution.",
  "priority_rationale": "Why this test has high information value.",
  "status": "queued",
  "resolution": null,
  "revision": 1,
  "created_at": "2026-09-26",
  "updated_at": "2026-09-26",
  "updated_by": "agent-or-human",
  "supersedes": null,
  "impact_state": "current",
  "relations": []
}